{
  "attempt": 1,
  "completed_at": null,
  "created_at": "2026-10-22T00:22:49Z",
  "error_summary": null,
  "evidence_paths": [],
  "input_manifest_hash": null,
  "parent_run_id": null,
  "project": "quant-foundry",
  "request_id": "cbb8f255c28ece43",
  "request_source": {
    "actor": "github-actions[bot]",
    "issue_number": null,
    "type": "schedule"
  },
  "resource_usage_summary": {
    "inference": {
      "usd": null,
      "used": false
    },
    "output_bytes": null,
    "wall_seconds": null
  },
  "result_paths": [],
  "run_id": "quant-foundry-20261022T002249Z-cbb8f255-a1",
  "schema_version": "1.0",
  "source_commit": "e3b47dffccbbb16847c232158cf54d40544da980",
  "started_at": "2026-10-22T00:22:49Z",
  "status": "running",
  "workflow_run_id": 39699308112
}
