{
  "attempt": 1,
  "completed_at": "2026-10-22T01:21:52Z",
  "created_at": "2026-10-22T01:21:23Z",
  "error_summary": null,
  "evidence_paths": [
    "https://github.com/mrrishit909/quant-foundry/actions/runs/39705174866"
  ],
  "input_manifest_hash": "sha256:242b6efb1fb7bdaee33f36476906944b6a5df05d5052f7dba6996dffe1f2e88d",
  "parent_run_id": null,
  "project": "quant-foundry",
  "request_id": "6dfa78d9cca00b6c",
  "request_source": {
    "actor": "mrrishit909",
    "issue_number": null,
    "type": "manual"
  },
  "resource_usage_summary": {
    "inference": {
      "usd": null,
      "used": false
    },
    "output_bytes": 404853,
    "wall_seconds": 29.0
  },
  "result_paths": [
    "runs/quant-foundry-20261022T012123Z-6dfa78d9-a1/assumptions.json",
    "runs/quant-foundry-20261022T012123Z-6dfa78d9-a1/benchmarks.json",
    "runs/quant-foundry-20261022T012123Z-6dfa78d9-a1/checks.json",
    "runs/quant-foundry-20261022T012123Z-6dfa78d9-a1/data_quality.json",
    "runs/quant-foundry-20261022T012123Z-6dfa78d9-a1/dataset.csv.gz",
    "runs/quant-foundry-20261022T012123Z-6dfa78d9-a1/equity.csv",
    "runs/quant-foundry-20261022T012123Z-6dfa78d9-a1/experiments.csv",
    "runs/quant-foundry-20261022T012123Z-6dfa78d9-a1/holdout.json",
    "runs/quant-foundry-20261022T012123Z-6dfa78d9-a1/manifest.json",
    "runs/quant-foundry-20261022T012123Z-6dfa78d9-a1/report.md",
    "runs/quant-foundry-20261022T012123Z-6dfa78d9-a1/results.json",
    "runs/quant-foundry-20261022T012123Z-6dfa78d9-a1/sensitivity.json",
    "runs/quant-foundry-20261022T012123Z-6dfa78d9-a1/strategies.json",
    "runs/quant-foundry-20261022T012123Z-6dfa78d9-a1/trades.csv",
    "runs/quant-foundry-20261022T012123Z-6dfa78d9-a1/walkforward.json",
    "runs/quant-foundry-20261022T012123Z-6dfa78d9-a1/holdout_audit.json"
  ],
  "run_id": "quant-foundry-20261022T012123Z-6dfa78d9-a1",
  "schema_version": "1.0",
  "source_commit": "3ec2537c01fa692d1f740e53367593a0f935e865",
  "started_at": "2026-10-22T01:21:23Z",
  "status": "completed",
  "workflow_run_id": 39705174866
}
