{
  "attempt": 1,
  "completed_at": null,
  "created_at": "2026-10-26T13:13:41Z",
  "error_summary": null,
  "evidence_paths": [],
  "input_manifest_hash": null,
  "parent_run_id": null,
  "project": "quant-foundry",
  "request_id": "768cdcd2eceb5d4b",
  "request_source": {
    "actor": "github-actions[bot]",
    "issue_number": null,
    "type": "schedule"
  },
  "resource_usage_summary": {
    "inference": {
      "usd": null,
      "used": false
    },
    "output_bytes": null,
    "wall_seconds": null
  },
  "result_paths": [],
  "run_id": "quant-foundry-20261026T131341Z-768cdcd2-a1",
  "schema_version": "1.0",
  "source_commit": "cf012dc2d32a01cab82c65f3d1f6cb6f153273f5",
  "started_at": "2026-10-26T13:13:41Z",
  "status": "running",
  "workflow_run_id": 40328725526
}
